<?xml version="1.0" encoding="UTF-8"?>
<OD xmlns="http://www.opentrafficsim.org/ots" xmlns:xsi="http://www.w3.org/2001/XMLSchema-instance"
  xsi:schemaLocation="http://www.opentrafficsim.org/ots ../../../../../../../../../../ots-parser-xml/src/main/resources/ots-demand.xsd"
  NAME="NAME" GLOBALINTERPOLATION="STEPWISE" GLOBALFACTOR="1.0">
  <!-- NAME: any name for the OD [optional] -->
  <!-- GLOBALINTERPOLATION: either "STEPWISE" or "LINEAR" (default) [optional] -->
  <!-- GLOBALFACTOR: factor on all demand, positive value or positive percentage [optional] -->

  <!-- GLOBALTIME: optional, if given at least 2 TIME values -->
  <GLOBALTIME>
    <!-- At least 2 -->
    <TIME VALUE="0s" />
    <TIME VALUE="1h" />
  </GLOBALTIME>

  <!-- CATEGORY: required to separate demand among GTU types, routes or lanes [optional] -->
  <!-- NAME: used to refer to the category in DEMAND tag [required] -->
  <!-- GTUTYPE: id of GTU type as defined with network or in code [optional*] -->
  <!-- ROUTE: id of route [optional*] -->
  <!-- LANE: full id (linkid.laneid) of lane [optional*] -->
  <!-- * at least one of these three needs to be given, all categories need the same specified -->
  <!-- FACTOR: factor of demand for category, e.g. to use 10% trucks overall [optional] -->
  <CATEGORY NAME="CAR" GTUTYPE="CAR" ROUTE="AB" FACTOR="85%" />

  <!-- DEMAND: defines demand for one option in the OD -->
  <!-- ORIGIN: id of origin node [required] -->
  <!-- DESTINATION: id of destination node [required] -->
  <!-- CATEGORY: required when using categories [optional] -->
  <!-- INTERPOLATION: interpolation, if different from global [optional] -->
  <!-- FACTOR: factor applied to this demand, positive value or positive percentage [optional] -->
  <!-- LEVEL: demand level may be omitted if a category is specified, and another DEMAND tag without category for the same ORIGIN 
    and DESTINATION defines demand. This can be useful to e.g. define one demand pattern, and spread this over categories using factors. 
    [optional] -->
  <!-- TIME: if not given the global time will be used [optional] -->
  <!-- VALUE: either a frequency in veh/[time unit], or positive value or positive percentage. The latter can only be used if absolute 
    frequencies are defined in another DEMAND tag between the same ORIGIN and DESTINATION. All LEVEL tags in one sequence need to be 
    either intensity, or a factor. [required] -->
  <DEMAND ORIGIN="A" DESTINATION="B" CATEGORY="CAR" INTERPOLATION="LINEAR" FACTOR="1.15">
    <LEVEL TIME="0s" VALUE="1800veh/h" />
    <LEVEL TIME="2h" VALUE="1500veh/h" />
  </DEMAND>

  <!-- Example using factors. -->

  <!-- Main demand pattern between A and C; will not result in demand itself. -->
  <!-- All factors are applied, so we can also add a 1.15 here. -->
  <DEMAND ORIGIN="A" DESTINATION="C" INTERPOLATION="LINEAR" FACTOR="1.15">
    <LEVEL VALUE="500veh/h" />
    <LEVEL VALUE="1500veh/h" />
  </DEMAND>
  <!-- 85% to cars (factor in CATEGORY) -->
  <DEMAND ORIGIN="A" DESTINATION="C" CATEGORY="CAR" />
  <!-- Trucks with variable factor, additional to the CATEGORY factor -->
  <DEMAND ORIGIN="A" DESTINATION="C" CATEGORY="TRUCK">
    <LEVEL VALUE="0.1" />
    <LEVEL VALUE="0.15" />
  </DEMAND>
  <!-- Busses with a constant, but additional, factor to the CATEGORY factor of busses -->
  <DEMAND ORIGIN="A" DESTINATION="C" CATEGORY="BUS" FACTOR="150%" />

  <!-- Note: using factors and dynamic factors is fully flexible, which provides no guarantees as to a certain percentage of all 
    traffic being e.g. cars, whether factors add up to 1.0, etc. -->
  <!-- It is not required to specify all Origin/Destination/Category combinations, what is not specified is assumed 0 by ODMatrix -->

</OD>
